{
  "$schema": "https://json-schema.org/draft/2020-12/schema",
  "$id": "https://slingologyeis.dev/contract/schema/insight_set.schema.json",
  "title": "InsightSet",
  "description": "Spec 01 (Engine Contract) Section 8.5 — the result of evaluate_insights. Deviates from the section's illustrative sketch in one place: each TopicResult carries `insights` (a list), not a single nullable `insight` — real topics can trigger more than one insight at once (e.g. both a baseline_deviation and a trend insight together), matching what the text report actually prints.",
  "type": "object",
  "required": ["flight_id", "analysis_key", "fleet_key", "rules_hash", "topics", "header_warnings", "provenance"],
  "additionalProperties": false,
  "properties": {
    "flight_id": { "type": "string" },
    "analysis_key": { "type": "string" },
    "fleet_key": { "type": "string" },
    "rules_hash": { "type": "string" },
    "filters_hash": { "type": "string", "description": "Spec 09 §11.2: hash of the limit filters applied." },
    "topics": {
      "type": "array",
      "items": {
        "type": "object",
        "required": ["topic_id", "analysis", "insights", "metric_ids"],
        "additionalProperties": false,
        "properties": {
          "topic_id": { "type": "string" },
          "analysis": {
            "type": "object",
            "required": ["text"],
            "properties": { "text": { "type": "string" } }
          },
          "insights": { "type": "array", "items": { "$ref": "#/$defs/insight" } },
          "metric_ids": { "type": "array", "items": { "type": "string" } },
          "enabled": {
            "type": "boolean",
            "description": "Spec 14 §7.3 — the topic's enabled flag from rules/active.json, shown and editable on the topic card (the disable-topic silencing level)."
          },
          "trigger_status": {
            "type": "array",
            "description": "Spec 14 §7.3 — one entry per configured trigger on this topic, whether or not it fired, for the topic card's triggers disclosure.",
            "items": {
              "type": "object",
              "required": ["type", "met"],
              "additionalProperties": false,
              "properties": {
                "type": { "type": "string", "enum": ["threshold", "baseline_deviation", "trend"] },
                "met": { "type": ["boolean", "null"], "description": "null when there isn't enough data to evaluate." },
                "detail": { "type": ["string", "null"], "description": "e.g. \"1.2 std devs above all your flights, n=41\" or \"R² 0.30 over 23 flights\"." }
              }
            }
          },
          "limit_refs": {
            "type": "array",
            "description": "Spec 10 §4.1 (Spec 01 §8.5): references to the events owner — the rule's limit_refs (limit_id), or for engine_ecu_inflight its CAS alert (cas_id, v0.21) — each resolved to this flight's limit_exceedances insight for it, or null if none fired. Drives the mirrored badge (Spec 03 §5.2); never an insight of its own.",
            "items": {
              "type": "object",
              "required": ["insight_id"],
              "additionalProperties": false,
              "properties": {
                "limit_id": { "type": "string" },
                "cas_id": { "type": "string" },
                "insight_id": { "type": ["string", "null"] }
              },
              "oneOf": [{ "required": ["limit_id"] }, { "required": ["cas_id"] }]
            }
          }
        }
      }
    },
    "header_warnings": { "type": "array", "items": { "$ref": "#/$defs/diagnostic" } },
    "provenance": {
      "type": "object",
      "required": ["engine_version", "rules_hash", "source_keys"],
      "properties": {
        "engine_version": { "type": "string" },
        "schema_version": { "type": ["string", "null"] },
        "engine_profile": { "type": ["object", "null"] },
        "params_hash": { "type": ["string", "null"] },
        "rules_hash": { "type": "string" },
        "source_keys": { "type": "array", "items": { "type": "string" } }
      }
    }
  },
  "$defs": {
    "insight": {
      "type": "object",
      "required": ["id", "topic_id", "rule_id", "trigger", "severity", "message", "evidence", "confidence"],
      "additionalProperties": false,
      "properties": {
        "id": { "type": "string" },
        "topic_id": { "type": "string" },
        "rule_id": { "type": "string" },
        "trigger": { "type": "string", "enum": ["threshold", "baseline_deviation", "trend"] },
        "severity": { "type": "string", "enum": ["info", "watch", "warning", "limit"] },
        "message": {
          "type": "object",
          "required": ["text"],
          "properties": {
            "text": { "type": "string" },
            "values": {
              "type": "object",
              "properties": {
                "comparison": {
                  "type": "object",
                  "required": ["scope", "n"],
                  "properties": {
                    "scope": { "type": "string", "enum": ["band", "all"] },
                    "band": { "type": ["string", "null"] },
                    "n": { "type": "integer" }
                  }
                }
              }
            }
          }
        },
        "evidence": {
          "type": "array",
          "items": {
            "type": "object",
            "required": ["kind"],
            "properties": {
              "kind": { "type": "string", "enum": ["metric", "baseline_point", "series_window", "exceedance", "cas_event"], "description": "cas_event (Spec 01 v0.21): ref is the CAS event's event_id; ecu_run is retired." }
            }
          }
        },
        "confidence": {
          "type": "object",
          "required": ["level", "n"],
          "properties": {
            "level": { "type": "string", "enum": ["VERY_LOW", "LOW", "MODERATE", "GOOD"] },
            "n": { "type": "integer" }
          }
        },
        "note": { "type": "string" },
        "source": { "type": "string", "enum": ["limit", "cas"], "description": "Spec 01 v0.21: on limit_exceedances insights — an OM-limit target or a classified CAS alert." },
        "limit_id": { "type": "string", "description": "Spec 09 §11.3: set on limit_exceedances insights for a limit." },
        "cas_id": { "type": "string", "description": "Spec 09 v0.18: set on limit_exceedances insights for a CAS alert." },
        "filterable": { "type": "boolean", "description": "Spec 09 §6.3: whether this insight's limit can be filtered." },
        "filter": {
          "type": "object",
          "required": ["filter_id", "outcome"],
          "properties": {
            "filter_id": { "type": "string" },
            "outcome": { "type": "string", "enum": ["suppressed", "breach"] }
          }
        },
        "events": {
          "type": "array",
          "items": {
            "oneOf": [
              {
                "type": "object",
                "required": ["event_id", "elapsed_s", "duration_s", "observed_value", "excess", "suppressed_by"],
                "properties": {
                  "event_id": { "type": "string" },
                  "start_utc": { "type": "string" },
                  "elapsed_s": { "type": ["number", "null"] },
                  "duration_s": { "type": "number" },
                  "observed_value": { "type": "number" },
                  "excess": { "type": ["number", "null"] },
                  "suppressed_by": { "enum": ["magnitude", "duration", null] }
                }
              },
              {
                "type": "object",
                "description": "A CAS event (Spec 01 v0.21): no observed value or excess.",
                "required": ["event_id", "elapsed_s", "duration_s", "classification", "phase", "phase_uncertain", "suppressed_by"],
                "additionalProperties": false,
                "properties": {
                  "event_id": { "type": "string" },
                  "start_utc": { "type": "string" },
                  "elapsed_s": { "type": ["number", "null"] },
                  "duration_s": { "type": "number" },
                  "classification": { "type": "string", "enum": ["GROUND", "IN_FLIGHT"] },
                  "phase": { "type": "string" },
                  "phase_uncertain": { "type": "boolean" },
                  "rpm": { "type": ["number", "null"] },
                  "not_lane_check_reason": { "type": "string", "enum": ["rpm_below_band", "rpm_above_band", "too_long", "moving"] },
                  "lane_check_band": { "type": "object", "required": ["rpm", "tolerance"], "additionalProperties": false, "properties": { "rpm": { "type": "number" }, "tolerance": { "type": "number" } }, "description": "The profile's lane-check rpm and tolerance; present when not_lane_check_reason is an rpm miss, so a row can print it." },
                  "suppressed_by": { "enum": ["duration", null] }
                }
              }
            ]
          }
        }
      }
    },
    "diagnostic": {
      "type": "object",
      "required": ["code", "severity", "scope", "message"],
      "properties": {
        "code": { "type": "string" },
        "severity": { "type": "string", "enum": ["info", "warn", "error"] },
        "scope": { "type": "string", "enum": ["file", "flight", "fleet", "topic"] },
        "message": { "type": "string" },
        "refs": { "type": "object" }
      }
    }
  }
}
